<?xml version="1.0" encoding="utf-8"?>
<xs:schema xmlns:xsi="http://www.w3.org/2001/XMLSchema-instance" attributeFormDefault="unqualified" elementFormDefault="qualified" xmlns:xs="http://www.w3.org/2001/XMLSchema">
	<xs:element name="Employees">
		<xs:complexType>
			<xs:sequence>
				<xs:element maxOccurs="unbounded" name="Employee">
					<xs:complexType>
						<xs:sequence>
							<xs:element name="Name" type="xs:string" />
							<xs:element name="Department" type="xs:string" />
							<xs:element name="Salary" type="xs:decimal" />
							<xs:element name="JoiningDate" type="xs:date" />
						</xs:sequence>
						<xs:attribute name="id" type="xs:string" use="required" />
					</xs:complexType>
				</xs:element>
			</xs:sequence>
		</xs:complexType>
		<xs:unique name="UniqueEmployeeID">
			<xs:selector xpath="Employee"/>
			<xs:field xpath="@id"/>
		</xs:unique>
	</xs:element>
</xs:schema>